Incident ID,Incident Type,Location/Context,Verification,Neighborhood,Date,Time,Description,State Kidnapping?,Agencies Involved,# of Agents,# of Unmarked Police Vehicles,Associated License Plates,Notes,Latitude,Longitude,Month,Date Category,Style Key
INC-001,Raid,Workplace or Business,Confirmed,West University,11-Feb-2025,1:00 PM,ICE/HSI agents visited a restaurant to ask about employees and intimidate the owner with error-ridden paperwork,No,Immigration and Customs Enforcement (ICE) / Homeland Security Investigations (HSI) [part of ICE],3,1+,CPH4967,,32.230988,-110.971769,February 2025,Older than 6 months,Raid_Older than 6 months
INC-002,Raid,Workplace or Business,Confirmed,South Tucson,18-Mar-2025,,"ICE/HSI operation at a local business with a judicial warrant, seeking documents. Agents said it was prompted by a tip submitted to a national database about the business",No,Immigration and Customs Enforcement (ICE) / Homeland Security Investigations (HSI) [part of ICE],15,10+,"BNV1970, CRJ0909, CRJ0922, CTN4078, CTN4202, CWB7511, CWL6441, CWN3939, CWW1146",,32.199504,-110.976768,March 2025,Older than 6 months,Raid_Older than 6 months
INC-003,Aerial Surveillance (Aircraft),Unknown/Other,Confirmed,"Millville, Santa Rita Park, etc",27-Mar-2025,3:30 PM,"DEA-linked surveillance plane (most likely N656RT, but smaller chance it could be N156RF, which has the same livery) registered to a shell company called Heritage Aviation Management Ltd, flying a surveillance operation over Millville, Santa Rita Park, and surrounding neighborhoods. This operation likely involved other agencies, possibly including ICE.",Unknown or Not Applicable,"Drug Enforcement Administration (DEA), likely working with other agencies",Unknown,N/A,N/A,"This aircraft was attempting to hide its presence by not broadcasting any identification or position data via Mode S/ADS‑B, and so its flight path and other information does not appear on sites like ADS-B Exchange. This flight was instead verified, and its flight path estimated, via observation and photographs from the ground.",32.209475,-110.959306,March 2025,Older than 6 months,Aerial Surveillance (Aircraft)_Older than 6 months
INC-004,Aerial Surveillance (Aircraft),Unknown/Other,Confirmed,"Diamond Bell Ranch, Three Points, etc",31-Mar-2025,11:33 AM,DHS/CBP surveillance plane N51824 flying a possible surveillance operation over Diamond Bell Ranch and surrounding areas south of Three Points,Unknown or Not Applicable,Department of Homeland Security (DHS) / U.S. Customs and Border Protection (CBP),Unknown,N/A,N/A,,31.979363,-111.299932,March 2025,Older than 6 months,Aerial Surveillance (Aircraft)_Older than 6 months
INC-005,Aerial Surveillance (Aircraft),Unknown/Other,Confirmed,"University of Arizona, Rincon Heights, etc",17-Apr-2025,11:00 AM,"DEA-linked surveillance plane N656RT, registered to a shell company called Heritage Aviation Management Ltd, flying a surveillance operation over the University of Arizona and surrounding neighborhoods. This operation likely involved other agencies, possibly including ICE.",Unknown or Not Applicable,"Drug Enforcement Administration (DEA), likely working with other agencies",Unknown,N/A,N/A,"This aircraft was attempting to hide its presence by not broadcasting any identification or position data via Mode S/ADS‑B, and so its flight path and other information does not appear on sites like ADS-B Exchange. This flight was instead verified, and its flight path estimated, via observation and photographs from the ground.",32.231713,-110.950503,April 2025,Older than 6 months,Aerial Surveillance (Aircraft)_Older than 6 months
INC-006,Aerial Surveillance (Aircraft),Unknown/Other,Confirmed,"Bravo Park Lane, Fairgrounds, etc",23-Apr-2025,11:24 AM,DHS/CBP-operated surveillance helicopter N370SR flying a surveillance operation over neighborhoods,Unknown or Not Applicable,Department of Homeland Security (DHS) / U.S. Customs and Border Protection (CBP),Unknown,N/A,N/A,,32.167638,-110.956227,April 2025,Older than 6 months,Aerial Surveillance (Aircraft)_Older than 6 months
INC-007,Vehicle Stop,Public Roadway,Confirmed,East Barrio Hollywood,23-Apr-2025,1:20 PM,"Vehicle stop initiated by a Pima County Sheriff’s Dept. deputy for a traffic violation. Deputy then called Border Patrol as back up. An ICE officer in plain clothes arrived on scene after the Border Patrol and left after talking with other officers. Sheriff’s deputy said the person would be booked by PCSD. Eventually another unmarked vehicle arrived with two TPD officers in plain clothes. At the end of the incident, one of those officers drove away in the detained person’s vehicle.",Abduction(s) Occurred,"U.S. Border Patrol, Immigration and Customs Enforcement (ICE), Pima County Sheriff's Department (PCSD), Tucson Police Department (TPD)",6,2,CPH4874 (ICE); CWS9867 (TPD),,32.235204,-110.984443,April 2025,Older than 6 months,Vehicle Stop_Older than 6 months
INC-008,Vehicle Stop,Residential Area,Confirmed,Keeling,24-Apr-2025,6:30 AM,Manhunt conducted by ICE and at least one DEA agent in unmarked vehicles in a neighborhood,Attempted Abduction(s) — Unknown Outcome,"Immigration and Customs Enforcement (ICE), Drug Enforcement Administration (DEA)",7+,6,CBC9452; CTN4351; CWL6437; CWS5989; CWW1146,,32.255818,-110.969822,April 2025,Older than 6 months,Vehicle Stop_Older than 6 months
INC-009,Raid,Residential Area,Confirmed,Julia Keen,29-Apr-2025,,"Raid at a private residence involving ICE/HSI, DEA, and other agencies",Abduction(s) Occurred,Immigration and Customs Enforcement (ICE) / Homeland Security Investigations (HSI) [part of ICE]; Drug Enforcement Administration (DEA); Tucson Police Department (TPD); Sierra Vista Police Department (SVPD),Many,9+,CBC9510; CM58097; CM60189; CWB7597; CWG4407; CWW1164; CPH4886; CWN3813; CWP3302,,32.205306,-110.922353,April 2025,Older than 6 months,Raid_Older than 6 months
INC-010,Aerial Surveillance (Aircraft),Unknown/Other,Confirmed,Flowing Wells,1-May-2025,11:11 AM,DHS/CBP surveillance plane N51824 flying a surveillance operation over Flowing Wells and surrounding areas,Unknown or Not Applicable,Department of Homeland Security (DHS) / U.S. Customs and Border Protection (CBP),Unknown,N/A,N/A,,32.301505,-111.012095,May 2025,Older than 6 months,Aerial Surveillance (Aircraft)_Older than 6 months
INC-011,Raid,Residential Area,Confirmed,Sabino Terrace,1-May-2025,7:00 PM,Large home raid at an apartment complex involving ICE/HSI and U.S. Customs and Border Protection (possibly a US Border Patrol BORTAC team),Attempted Abduction(s) — Unknown Outcome,"Immigration and Customs Enforcement (ICE) / Homeland Security Investigations (HSI) [part of ICE], U.S. Customs and Border Protection (possibly US Border Patrol)",12+,12+,BHR1013; CWW1822,,32.294337,-110.820992,May 2025,Older than 6 months,Raid_Older than 6 months
INC-012,Aerial Surveillance (Aircraft),Unknown/Other,Confirmed,"University of Arizona, West University, etc",6-May-2025,4:20 PM,"DEA-linked surveillance plane N656RT or N156RF, registered to a shell company called Heritage Aviation Management Ltd, flying a surveillance operation over the University of Arizona and surrounding neighborhoods. This operation likely involved other agencies, possibly including ICE.",Unknown or Not Applicable,"Drug Enforcement Administration (DEA), likely working with other agencies",Unknown,N/A,N/A,,32.227698,-110.959439,May 2025,Older than 6 months,Aerial Surveillance (Aircraft)_Older than 6 months
INC-013,Aerial Surveillance (Aircraft),Unknown/Other,Confirmed,"Downtown, Armory Park, etc",20-May-2025,4:20 PM,DHS/CBP surveillance helicopter N370SR flying a surveillance operation over downtown Tucson and surrounding neighborhoods,Unknown or Not Applicable,Department of Homeland Security (DHS) / U.S. Customs and Border Protection (CBP),Unknown,N/A,N/A,,32.221767,-110.972394,May 2025,Older than 6 months,Aerial Surveillance (Aircraft)_Older than 6 months
INC-014,Raid,Residential Area,Confirmed,Wakefield,28-May-2025,9:45 AM,"Two ICE agents impersonated Tucson Electric Power (TEP) workers in an attempt to get inside the home of a person they were targeting. A clever neighbor realized they were lying in time to call out the agents' lie, and they left the neighborhood empty-handed",No,Immigration and Customs Enforcement (ICE),2,2,CWS9854,The incident was covered by journalists including Emily Bregel of the Arizona Daily Star (https://tucson.com/news/local/border/article_e949f7c5-d339-4546-804c-cbb3c970af38.html) and Reyna Preciado of KGUN (https://www.kgun9.com/news/community-inspired-journalism/southside-news/southside-neighbors-confront-tep-impersonators-suspected-immigration-enforcement-officers),32.172229,-110.968211,May 2025,Older than 6 months,Raid_Older than 6 months
INC-015,Aerial Surveillance (Aircraft),Unknown/Other,Confirmed,"Drexel Heights, etc",28-May-2025,2:44 PM,DHS/CBP surveillance helicopter N370SR flying a surveillance operation over Drexel Heights and surrounding neighborhoods in coordination with unmarked vehicles on the ground,Unknown or Not Applicable,Department of Homeland Security (DHS) / U.S. Customs and Border Protection (CBP),Unknown,N/A,N/A,,32.133725,-111.028626,May 2025,Older than 6 months,Aerial Surveillance (Aircraft)_Older than 6 months
INC-016,Gathering/Staging,Public Park,Confirmed,Drexel Heights,28-May-2025,3:14 PM,"Four unmarked police vehicles (unknown agency) observed staging in a public park, with at least one more nearby. DHS/CBP helicopter N370SR was conducting surveillance of the area from above",Unknown or Not Applicable,"Department of Homeland Security (DHS) / U.S. Customs and Border Protection (CBP), possibly others",6+,4+,6KA 0GF; CTN4409; YBA 4GL,,32.126258,-111.028175,May 2025,Older than 6 months,Gathering/Staging_Older than 6 months
INC-017,Gathering/Staging,Commercial Area,Confirmed,Drexel Heights,28-May-2025,3:24 PM,"One unmarked police vehicle observed waiting at a Circle K in the same neighborhood where other unmarked vehicles had been observed staging and a DHS/CBP helicopter (N370SR) was flying overhead. It is not clear what, if any, operation these vehicles were involved in",Unknown or Not Applicable,"Department of Homeland Security (DHS) / U.S. Customs and Border Protection (CBP) was involved, but could not confirm which agency was connected to this specific vehicle",1+,1,,,32.119795,-111.028683,May 2025,Older than 6 months,Gathering/Staging_Older than 6 months
INC-018,Vehicle Stop,Public Roadway,Credible Report But Unconfirmed,Bronx Park,1-Jun-2025,5:53 PM,Vehicle stop conducted by agents in three unmarked vehicles in which one person was kidnapped,Abduction(s) Occurred,"Likely Arizona Department of Public Safety (AZDPS) and/or another agency like ICE that participates in the Gang Intelligence Team Enforcement Mission (GIITEM), sometimes also called the State Gang Task Force, a multi-agency task force led by AZDPS that includes federal (including ICE), state, county, and local police agencies",3+,3,0NA 8GE; 2LA0YT; 76A73E,,32.237116,-110.97786,June 2025,Older than 6 months,Vehicle Stop_Older than 6 months
INC-019,Aerial Surveillance (Aircraft),Unknown/Other,Confirmed,"Rose, West Lamar, etc",3-Jun-2025,4:02 PM,DHS/CBP surveillance plane N51824 flying a surveillance operation over Rose and surrounding neighborhoods,Unknown or Not Applicable,Department of Homeland Security (DHS) / U.S. Customs and Border Protection (CBP),Unknown,N/A,N/A,,32.172134,-110.981839,June 2025,Older than 6 months,Aerial Surveillance (Aircraft)_Older than 6 months
INC-020,Raid,Residential Area,Confirmed,Midvale Park,11-Jun-2025,12:30 PM,Large multi-agency home raid involving a warrant for drug offenses with participation by the US Border Patrol and ICE,Abduction(s) Occurred,"US Border Patrol, Immigration and Customs Enforcement (ICE) / Homeland Security Investigations (HSI) [part of ICE], Pinal County Sheriff's Office (PCSO), Tucson Police Department (TPD)",Many,5+,VE-88-312 (Sonora); SYA 6DP; VE-09-700 (Sonora); CWS9640,,32.162283,-110.998369,June 2025,Older than 6 months,Raid_Older than 6 months
INC-021,Raid,Residential Area,Confirmed,Midvale Park,11-Jun-2025,1:40 PM,Large multi-agency home raid involving a warrant for drug offenses with participation by the US Border Patrol and ICE,Abduction(s) Occurred,"US Border Patrol, Immigration and Customs Enforcement (ICE) / Homeland Security Investigations (HSI) [part of ICE], Pinal County Sheriff's Office (PCSO), Tucson Police Department (TPD)",Many,5+,CWN3831; SXA 9DP; SYA 3DP; CWW1045; CWW1591,,32.158727,-111.000236,June 2025,Older than 6 months,Raid_Older than 6 months
INC-022,Raid,Residential Area,Confirmed,Midvale Park,11-Jun-2025,9:00 PM,Large multi-agency home raid involving a warrant for drug offenses with participation by the US Border Patrol and ICE,Abduction(s) Occurred,"US Border Patrol, Immigration and Customs Enforcement (ICE) / Homeland Security Investigations (HSI) [part of ICE], Pinal County Sheriff's Office (PCSO), Tucson Police Department (TPD)",Many,5+,7MA 0CW; SXA 9DP; CFT1138; CWW1591; SYA 3DP,,32.158044,-110.999962,June 2025,Older than 6 months,Raid_Older than 6 months
INC-023,Vehicle Stop,PubIic Roadway: Highway,Confirmed,Mission View,12-Jun-2025,12:20 PM,"Vehicle stop of a livery van initiated by Arizona Department of Public Safety (AZDPS) state troopers, who then called the Border Patrol. During the time on scene, Border Patrol agents moved two young men from the back of a Border Patrol van to a Border Patrol truck, but apparently they had been detained at a previous incident. Unclear whether anyone was kidnapped from the vehicle stopped here",Attempted Abduction(s) — Unknown Outcome,"US Border Patrol, Arizona Department of Public Safety (AZDPS)",5+,3+,X7A 2AJ; AF-703X,,32.189072,-110.973134,June 2025,Older than 6 months,Vehicle Stop_Older than 6 months
INC-024,Aerial Surveillance (Aircraft),Unknown/Other,Confirmed,"South Park, South Tucson, etc",16-Jun-2025,11:18 AM,DHS/CBP surveillance plane N51824 flying a surveillance operation over South Park and surrounding neighborhoods,Unknown or Not Applicable,Department of Homeland Security (DHS) / U.S. Customs and Border Protection (CBP),Unknown,N/A,N/A,,32.192379,-110.947004,June 2025,Older than 6 months,Aerial Surveillance (Aircraft)_Older than 6 months
INC-025,Vehicle Stop,Public Roadway,Confirmed,Bravo Park Lane,19-Jun-2025,,Vehicle stop conducted by suspected ICE agents wearing plain clothes and driving three unmarked vehicles. Uknnown whether anyone was kidnapped,Attempted Abduction(s) — Unknown Outcome,Immigration and Customs Enforcement (ICE) [unconfirmed],5-6,3,VE-88-312 (Sonora plate),,32.176787,-110.951541,June 2025,Older than 6 months,Vehicle Stop_Older than 6 months
INC-026,Aerial Surveillance (Aircraft),Unknown/Other,Confirmed,"Limberlost, Nat'l City Northwest, etc",24-Jun-2025,6:40 PM,DHS/CBP helicopter N184R involved in vehicle pursuit led by the Border Patrol that began near Paragonia and continued through multiple locations in Tucson,Abduction(s) Occurred,Department of Homeland Security (DHS) / U.S. Customs and Border Protection (CBP),Unknown,N/A,N/A,"The Tucson Sentinel reported on this incident, but failed to mention that there were actually two CBP helicopters involved, not one, and that the US Army National Guard and Tucson Police Department also participated. See that story here: https://www.tucsonsentinel.com/local/report/062425_bp_raids_home/border-patrol-agents-raid-tucson-photographers-home-tuesday-night/",32.286447,-110.978092,June 2025,Older than 6 months,Aerial Surveillance (Aircraft)_Older than 6 months
INC-027,Aerial Surveillance (Aircraft),Unknown/Other,Confirmed,Barrio Nopal,24-Jun-2025,6:40 PM,DHS/CBP helicopter N3320A involved in vehicle pursuit led by the Border Patrol that began near Paragonia and continued through multiple locations in Tucson,Abduction(s) Occurred,Department of Homeland Security (DHS) / U.S. Customs and Border Protection (CBP),Unknown,N/A,N/A,"The Tucson Sentinel reported on this incident, but failed to mention that there were actually two CBP helicopters involved, not one, and that the US Army National Guard and Tucson Police Department also participated. See that story here: https://www.tucsonsentinel.com/local/report/062425_bp_raids_home/border-patrol-agents-raid-tucson-photographers-home-tuesday-night/",32.124993,-110.967782,June 2025,Older than 6 months,Aerial Surveillance (Aircraft)_Older than 6 months
INC-028,Aerial Surveillance (Aircraft),Unknown/Other,Confirmed,"Doolen-Fruitvale, Nat'l City Northwest, Rose, etc",24-Jun-2025,8:24 PM,"US Army National Guard helicopter 12-72235 involved in vehicle pursuit led by the Border Patrol that began near Paragonia and continued through multiple locations in Tucson, where this helicopter joined",Abduction(s) Occurred,US Army National Guard,Unknown,N/A,N/A,"The Tucson Sentinel reported on this incident, but failed to mention that there were actually two CBP helicopters involved, not one, and that the US Army National Guard and Tucson Police Department also participated. See that story here: https://www.tucsonsentinel.com/local/report/062425_bp_raids_home/border-patrol-agents-raid-tucson-photographers-home-tuesday-night/",32.255894,-110.921175,June 2025,Older than 6 months,Aerial Surveillance (Aircraft)_Older than 6 months
INC-029,Vehicle Stop,Residential Area,Confirmed,Doolen-Fruitvale,24-Jun-2025,8:24 PM,"Vehicle pursuit by Border Patrol (but also involving ICE/HSI, the US Army National Guard, TPD, and possibly other agencies) that started near Patagonia and continued through multiple locations in Tucson. Three helicopters, including two CBP aircraft and one operated by the US Army National Guard, participated. The incident ended in the Doolen-Fruitvale neighborhood, where Border Patrol entered and unsuccessfully searched at least one home",Abduction(s) Occurred,"US Border Patrol, Immigration and Customs Enforcement (ICE) / Homeland Security Investigations (HSI) [part of ICE], US Army National Guard, Tucson Police Department (TPD)",Many,6+,CWL6344; CRJ1058; JHA1BLA; KGA2BMA; CX55461,"The Tucson Sentinel reported on this incident, but failed to mention that there were actually two CBP helicopters involved, not one, and that the US Army National Guard and Tucson Police Department also participated. See that story here: https://www.tucsonsentinel.com/local/report/062425_bp_raids_home/border-patrol-agents-raid-tucson-photographers-home-tuesday-night/",32.255881,-110.922588,June 2025,Older than 6 months,Vehicle Stop_Older than 6 months
INC-030,Stakeout/Surveillance,Religious Site,Credible Report But Unconfirmed,Santa Rita Park,9-Jul-2025,6:30 AM,"Suspected ICE agents in 5-6 unmarked vehicles observed prowling around a church/day laborer organization and a nearby nonprofit. ICE has been documented prowling around at least one of these locations before, which workers have interpreted as an attempt to threaten and intimidate workers",No,Immigration and Customs Enforcement (ICE) [unconfirmed],5-6+,5-6+,CWD1009; CWL3051,,32.205731,-110.973092,July 2025,Older than 6 months,Stakeout/Surveillance_Older than 6 months
INC-031,Stakeout/Surveillance,Unknown/Other,Credible Report But Unconfirmed,Barrio Viejo,9-Jul-2025,7:30 AM,"Suspected ICE agents in 5-6 unmarked vehicles observed prowling around a church/day laborer organization and a nearby nonprofit. ICE has been documented prowling around at least one of these locations before, which workers have interpreted as an attempt to threaten and intimidate workers",No,Immigration and Customs Enforcement (ICE) [unconfirmed],5-6+,5-6+,CWD1009; CWL3051,,32.211992,-110.975618,July 2025,Older than 6 months,Stakeout/Surveillance_Older than 6 months
INC-032,Vehicle Stop,Public Roadway,Credible Report But Unconfirmed,Barrio Santa Rosa,14-Jul-2025,4:38 PM,Vehicle stop conducted by two unknown agents in black clothing driving an unmarked Chevrolet Silverado. Witnessed and photographed by passerby but further details not available.,Attempted Abduction(s) — Unknown Outcome,Unknown,2+,1+,,,32.207014,-110.971542,July 2025,Older than 6 months,Vehicle Stop_Older than 6 months
INC-033,Stakeout/Surveillance,Residential Area,Confirmed,Ranchwood Community,17-Jul-2025,12:50 PM,At least three ICE agents in two unmarked vehicles observed prowling around a manufactured home community,Attempted Abduction(s) — Unknown Outcome,Immigration and Customs Enforcement (ICE),3,2,CWN3813; CMG8700,,32.148866,-110.917811,July 2025,Older than 6 months,Stakeout/Surveillance_Older than 6 months
INC-034,Stakeout/Surveillance,Residential Area,Confirmed,Campus Farm,25-Jul-2025,4:12 PM,"Multiple agents with ICE, the US Marshals, and the Arizona Dept of Corrections conducting surveillance of a neighborhood in unmarked vehicles",Attempted Abduction(s) — Unknown Outcome,"US Marshals, Immigration and Customs Enforcement (ICE), Arizona Department of Corrections, Rehabilitation and Reentry (ADCRR)",2+,3+,CL33001; CPH4705; 4FA1CSA,,32.274827,-110.956686,July 2025,Older than 6 months,Stakeout/Surveillance_Older than 6 months
INC-035,Stakeout/Surveillance,Residential Area,Confirmed,Campus Farm,28-Jul-2025,4:08 PM,"Multiple agents with ICE, the US Marshals, and the Arizona Dept of Corrections conducting surveillance of a neighborhood in unmarked vehicles",Attempted Abduction(s) — Unknown Outcome,"US Marshals, Immigration and Customs Enforcement (ICE), Arizona Department of Corrections, Rehabilitation and Reentry (ADCRR)",1+,1+,4FA1CSA,,32.272121,-110.954842,July 2025,Older than 6 months,Stakeout/Surveillance_Older than 6 months
INC-036,Aerial Surveillance (Aircraft),Unknown/Other,Confirmed,"Mountain 1st Avenue, Keeling, etc",28-Jul-2025,6:45 PM,"DHS/CBP helicopter (identified through observation and photographs as CBP but whose tail number could not be identified) flying a surveillance operation over Mountain 1st Avenue, Keeling, and surrounding neighborhoods",Unknown or Not Applicable,Department of Homeland Security (DHS) / U.S. Customs and Border Protection (CBP),Unknown,N/A,N/A,,32.254041,-110.960529,July 2025,Older than 6 months,Aerial Surveillance (Aircraft)_Older than 6 months
INC-037,Stakeout/Surveillance,Residential Area,Confirmed,Campus Farm,29-Jul-2025,11:43 AM,"Multiple agents with ICE, the US Marshals, and the Arizona Dept of Corrections conducting surveillance of a neighborhood in unmarked vehicles",Attempted Abduction(s) — Unknown Outcome,"US Marshals, Immigration and Customs Enforcement (ICE), Arizona Department of Corrections, Rehabilitation and Reentry (ADCRR)",8+,8+,CTN4392; CWW1277; CPH4705; CM59939; CM60201; CWS9674; BND7459,,32.275734,-110.956674,July 2025,Older than 6 months,Stakeout/Surveillance_Older than 6 months
INC-038,Vehicle Stop,Commercial Area,Confirmed,Park Place Mall,6-Aug-2025,,Vehicle stop involving ICE in the Park Place Mall parking lot. At least one person was kidnapped,Abduction(s) Occurred,Immigration and Customs Enforcement (ICE),5-6,4,CWN3915; CTN4388; CWD1071; CWW1873,,32.218344,-110.859031,August 2025,Older than 6 months,Vehicle Stop_Older than 6 months
INC-039,Stakeout/Surveillance,Commercial Area,Credible Report But Unconfirmed,Roger Park,10-Aug-2025,,"Two unknown agents in unmarked vehicles observed prowling a Lowe's Home Improvement store parking lot. Location and behavior of the agents is consistent with ICE, but we could confirm",Unknown or Not Applicable,Unknown,2+,2,7RA 65F; CMV2055,,32.282056,-110.979415,August 2025,Older than 6 months,Stakeout/Surveillance_Older than 6 months
INC-040,Vehicle Stop,Public Roadway,Confirmed,Mountain 1st Avenue,22-Aug-2025,6:00 AM,Vehicle stop conducted by five ICE agents in three unmarked vehicles. At least one person was kidnapped and his vehicle was left on the side of the road,Abduction(s) Occurred,Immigration and Customs Enforcement (ICE),5,3,CWW1146; CL77972; CM60348,,32.257506,-110.956549,August 2025,Older than 6 months,Vehicle Stop_Older than 6 months
INC-041,Unknown/Other,Commercial Area,Confirmed,Rose,25-Aug-2025,,ICE agents in 5-6 unmarked vehicles observed in a business parking lot. Unclear whether it was a business raid or a vehicle stop of some kind,Unknown or Not Applicable,Immigration and Customs Enforcement (ICE),5-6+,5-6,CWW1473; BNV1839,,32.174587,-110.977574,August 2025,Older than 6 months,Unknown/Other_Older than 6 months
INC-042,Raid,Residential Area,Confirmed,Vista del Monte,2-Sep-2025,2:40 PM,"ICE agents in at least one unmarked vehicle kidnapped two parents from an apartment complex. They then coerced the parents to lead them to their child's elementary school, John E. White Elementary School (documented as a separate), to kidnap the child. The ICE agents forced the mother to wear an electronic monitoring device on her ankle at the school as she collected the child.",Abduction(s) Occurred,Immigration and Customs Enforcement (ICE),2+,1,BNV1839,,32.250572,-110.897013,September 2025,Older than 6 months,Raid_Older than 6 months
INC-043,Unknown/Other,School,Confirmed,Garden City,2-Sep-2025,3:50 PM,"ICE agents in at least one unmarked vehicle kidnapped two parents from an apartment complex (incident listed separately). They then coerced the parents to lead them to their child's elementary school, John E. White Elementary School, to kidnap the child. The ICE agents forced the mother to wear an electronic monitoring device on her ankle at the school as she collected the child.",Abduction(s) Occurred,Immigration and Customs Enforcement (ICE),2+,1,BNV1839,,32.152024,-111.018026,September 2025,Older than 6 months,Unknown/Other_Older than 6 months
